{
  "run_label": "good-fixture",
  "v_tag": [
    "research",
    "design",
    "schema",
    "validator",
    "formal",
    "core",
    "high-stakes"
  ],
  "units": [
    {
      "id": "U01",
      "title": "Modern-research landscape",
      "goal": "map the landscape",
      "executor_persona": "Researcher",
      "verifier_persona": "Skeptic",
      "deps": [],
      "outputs": [
        "units/U01/debrief.json"
      ],
      "est_footprint_tokens": 21000,
      "acceptance_criteria": [
        "10-14 findings",
        "each with >=1 dated primary source"
      ],
      "tags": [
        "research",
        "core",
        "high-stakes"
      ],
      "dod_refs": [
        "DoD-A"
      ]
    },
    {
      "id": "U02",
      "title": "Design",
      "goal": "score approaches",
      "executor_persona": "Architect",
      "verifier_persona": "Pragmatist",
      "deps": [
        "U01"
      ],
      "outputs": [
        "units/U02/debrief.json"
      ],
      "est_footprint_tokens": 18000,
      "acceptance_criteria": [
        "traceable to requirements"
      ],
      "tags": [
        "design",
        "core"
      ],
      "dod_refs": [
        "DoD-A"
      ]
    },
    {
      "id": "U03",
      "title": "Ship the toolbars",
      "goal": "Add a toolbar to all four views.",
      "executor_persona": "Researcher",
      "verifier_persona": "Skeptic",
      "deps": [],
      "est_footprint_tokens": 8000,
      "acceptance_criteria": [
        "All four views render a toolbar."
      ],
      "tags": [
        "core"
      ],
      "dod_refs": [
        "DoD-A"
      ],
      "priority_class": "directive"
    }
  ],
  "edges": [
    {
      "from": "U01",
      "to": "U02"
    }
  ],
  "waves": [
    {
      "wave": 1,
      "units": [
        "U01"
      ]
    },
    {
      "wave": 2,
      "units": [
        "U02",
        "U03"
      ]
    }
  ],
  "revision": 2,
  "amendments_applied": [
    "A01"
  ],
  "baseline_units": [
    "U01",
    "U02"
  ],
  "fuel_initial": 4
}
